{
  "runtime": "codex",
  "version": "0.48.0",
  "surfaces": [
    "app_server"
  ],
  "capabilities": {
    "observe": {
      "announced": "supported_tested",
      "validated": "supported_tested"
    },
    "converse": {
      "announced": "supported_tested",
      "validated": "supported_tested"
    },
    "remote_approval": {
      "announced": "supported_tested",
      "validated": "supported_tested"
    },
    "pre_tool_control": {
      "announced": "partial",
      "validated": "partial",
      "detail": "Only commands and patches that reach the native approval flow are seen before execution."
    },
    "interrupt_turn": {
      "announced": "supported_tested",
      "validated": "supported_tested"
    },
    "stop_process": {
      "announced": "supported_tested",
      "validated": "supported_tested"
    },
    "resume": {
      "announced": "supported_tested",
      "validated": "experimental"
    },
    "subagent_tracking": {
      "announced": "unsupported",
      "validated": "unsupported"
    }
  }
}
